提供元案件番号,委託元,業界,PJフェーズ,モジュール,SAP案件,単価,募集人数,開始日,終了日,勤務地,案件概要,必須要件,歓迎要件,言語力,メインポジション,商流
0128588,INTLOOP,製造業,要件定義～稼働,FI,〇,120～160万円,1,即日,2024年7月末,フルリモート,"・SAP会計グローバルロールアウトPJTの中国展開メンバーとして参画
・FI導入で要件定義～稼働まで対応
・クライアントフェーシング
・SAP-FI(GL/AP/AR/AA/配賦)の標準機能/カスタマイズ設定
・稼働率：100～100％
・期間：即日～2024年7月末(延長の可能性有)
・希望年齢：30～55歳
・英語力：会話不要、読み書き不要
・精算時間幅：固定
・募集人数：1名
・備考：1年に2～3回程度、2週間程度の中国渡航の可能性有
・フルリモート勤務
・月間想定工数：160～160時間（FTE 1.0～1.0）","・FI導入で要件定義～稼働まで一通りのフェーズ経験
・クライアントフェーシングの経験
・SAP-FI(GL/AP/AR/AA/配賦)の標準機能/カスタマイズ設定スキル
・中国語の読書/会話能力",要確認,中国語,コンサルタント,要確認